{
 "text": "BOULDER, Colo. -- Nobody would have flinched had Khalil Tate knelt and kissed the grass at Folsom Field.\n\n\"Colorado holds a special place in my heart,\" Arizona's senior dual-threat quarterback said after throwing for 404 yards and three touchdowns in the Wildcats' 35-30 win over the banged-up Buffaloes.\n\nIt was here in Boulder two years ago that Tate burst through so many tackles and onto the college football scene by rushing for 327 yards, an FBS record for a QB, in leading Arizona to a 45-42 win in relief of injured starter Brandon Dawkins.\n\nThis time, he beat the Buffaloes with his arm, just like he did last year in Tucson, when he threw for five TDs in another shootout survival by the `Cats.\n\n\"I love playing Colorado,\" said Arizona linebacker Tony Fields. \"It's always an intense game. It always goes down to the wire.\"\n\nThis one also featured an amazing nine lead changes, back-to-back touchdown throws on drives that took all of nine and 10 seconds, a razzle-dazzle touchdown , and, finally, a pair of fourth-quarter stands by Arizona, one at the goal line and the other a fourth-down game-stopper at midfield.\n\nTate completed 31 of 41 passes and only ran four times, including a 7-yard scamper on third-and-6 from midfield in the closing minutes that allowed Arizona (4-1, 2-0) to run out the clock and leave Folsom Field as the Pac-12 South's last unbeaten team.\n\nThe Buffaloes (3-2, 1-1) sorely missed star receiver Laviska Shenault (core muscle), CB Chris Miller (knee) and DE Mustafa Johnson (ankle), all of whom sat out and were joined on the sideline Saturday by safety Mikial Onu (torso), receiver K.D. Nixon (unspecified), and nose tackle Jalen Sami (knee).\n\nOnu had a first-half interception and Nixon a first-half touchdown throw.\n\n\"Next man up is not a cliche, it's what's required,\" Colorado coach Mel Tucker said. \"There's really no excuse and no explanation\" for the Buffs' breakdowns with so many backups filling the field, he insisted.\n\nThe Wildcats weren't whistled for a penalty until the final play of the third quarter -- offside -- during the Buffalos' longest drive of the day, a 14-play marathon that stalled with Colorado failing to score on three plays from inside the Arizona 5.\n\nThey settled for James Stefanou 's 20-yard field goal and a 30-28 lead.\n\n\"That was the difference in the game,\" Arizona coach Kevin Sumlin said.\n\n Nathan Tilford 's 5-yard TD run put Arizona back on top 35-30 with 6:51 left.\n\nThe Buffaloes drove to midfield and converted a fourth down but on third-and-4 from the Arizona 46, quarterback Steven Montez didn't recognize two open receivers on slant routes up the middle when the Wildcats blitzed two linebackers. Instead, he overthrew a receiver on a go-route down the right sideline.\n\nThat brought up fourth down and his throw to Dimitri Stanley was too high and Arizona took over with 2:23 remaining.\n\n\"To get a fourth-down stop, that's the one everyone is going to point to,\" Sumlin said.\n\nWILD SECOND QUARTER\n\nColorado took a 20-14 halftime lead after a wild second quarter that almost ended with a touchdown return on a squib kick.\n\nOn third-and-3 from the Arizona 12, Montez scrambled before finding tight end Brady Russell for the score with 3 seconds remaining.\n\n\"Initially, everybody was covered, so I just kind of figured I would scramble around,\" said Montez, who knew he could throw it away if no one was open, sending the field goal unit out. But with no timeouts left, \"all I needed to do was not take a sack,\" Montez said.\n\n\"I avoided a couple of defensive linemen, saw Brady (Russell) sitting in the corner with his hands up\" and delivered the TD strike.\n\nThe Buffaloes squibbed the kickoff and Jamarye Joiner scooped it up at his 10 and raced down the opponents' sideline for an apparent touchdown only to turn around and realize he'd stepped out of bounds at the Colorado 46.\n\nThe Buffs went ahead 14-13 when Montez got the ball into the hands of tailback Jaren Mangham , who flipped it to a reversing Nixon, who threw a pinpoint pass to Dimitri Stanley for a 39-yard score.\n\nTate replied with a 75-yard TD toss to Peterson, who burned Onu, whose interception at midfield had set up Stanley's touchdown. Onu appeared to get hurt on the play.\n\nWith Shenault and Nixon ailing, Tony Brown led Colorado with 10 catches for 141 yards.\n\nFLAG FOOTBALL\n\nThe Buffaloes were whistled eight times for 85 yards in penalties and the Wildcats were flagged just once for 5 yards.\n\nUP NEXT\n\nArizona: host Washington on Oct. 12.\n\nColorado Visits Oregon on Friday night.\n\n---\n\nFollow Arnie Melendrez Stapleton on Twitter: http://twitter.com/arniestapleton\n\n---\n\nFor more AP college football coverage: https://apnews.com/tag/Collegefootball and https://twitter.com/AP-Top25\n\n<ts></ts>",
 "timeseries": [
  {
   "values": [
    0,
    0,
    0,
    0,
    0,
    0,
    0,
    0,
    0,
    0,
    0,
    0,
    0,
    0,
    0,
    0,
    0,
    0,
    0,
    0,
    0,
    0,
    0,
    0,
    0,
    0,
    0,
    0,
    0,
    0,
    0,
    0,
    0,
    0,
    0,
    0,
    0,
    0,
    0,
    7,
    7,
    7,
    7,
    7,
    7,
    7,
    7,
    7,
    7,
    7,
    7,
    7,
    7,
    7,
    7,
    7,
    7,
    7,
    7,
    7,
    7,
    7,
    7,
    7,
    7,
    7,
    7,
    7,
    7,
    7,
    7,
    7,
    7,
    7,
    7,
    7,
    7,
    7,
    7,
    7,
    7,
    7,
    14,
    14,
    14,
    14,
    14,
    14,
    14,
    14,
    14,
    14,
    14,
    14,
    14,
    14,
    14,
    14,
    14,
    14,
    14,
    14,
    14,
    21,
    21,
    21,
    21,
    21,
    21,
    21,
    21,
    21,
    21,
    21,
    21,
    21,
    21,
    21,
    21,
    21,
    21,
    21,
    21,
    21,
    21,
    21,
    21,
    21,
    21,
    21,
    21,
    21,
    21,
    21,
    21,
    28,
    28,
    28,
    28,
    28,
    28,
    28,
    28,
    28,
    28,
    28,
    28,
    28,
    28,
    28,
    28,
    28,
    28,
    28,
    28,
    28,
    28,
    28,
    28,
    28,
    28,
    28,
    28,
    28,
    28,
    28,
    28,
    35,
    35,
    35,
    35,
    35,
    35,
    35,
    35,
    35,
    35,
    35,
    35,
    35,
    35,
    35,
    35,
    35,
    35,
    35,
    35,
    35,
    35,
    35
   ],
   "unit": "away_score_cumulative",
   "freq": "1play"
  },
  {
   "values": [
    0,
    0,
    0,
    0,
    0,
    0,
    0,
    0,
    0,
    0,
    0,
    0,
    0,
    3,
    3,
    3,
    3,
    3,
    3,
    3,
    3,
    3,
    3,
    3,
    3,
    3,
    3,
    3,
    3,
    3,
    3,
    3,
    3,
    3,
    3,
    3,
    3,
    3,
    3,
    3,
    3,
    3,
    3,
    3,
    3,
    3,
    3,
    3,
    3,
    3,
    3,
    3,
    3,
    3,
    3,
    3,
    3,
    3,
    3,
    3,
    3,
    3,
    3,
    3,
    3,
    3,
    3,
    3,
    3,
    3,
    3,
    3,
    3,
    3,
    6,
    6,
    6,
    6,
    6,
    6,
    13,
    13,
    13,
    13,
    13,
    13,
    13,
    13,
    13,
    13,
    13,
    13,
    13,
    13,
    20,
    20,
    20,
    20,
    20,
    20,
    20,
    20,
    20,
    20,
    20,
    20,
    20,
    20,
    20,
    20,
    20,
    20,
    20,
    20,
    20,
    20,
    20,
    20,
    20,
    20,
    20,
    20,
    20,
    20,
    20,
    20,
    20,
    20,
    27,
    27,
    27,
    27,
    27,
    27,
    27,
    27,
    27,
    27,
    27,
    27,
    27,
    27,
    27,
    27,
    27,
    27,
    27,
    27,
    27,
    27,
    27,
    27,
    27,
    30,
    30,
    30,
    30,
    30,
    30,
    30,
    30,
    30,
    30,
    30,
    30,
    30,
    30,
    30,
    30,
    30,
    30,
    30,
    30,
    30,
    30,
    30,
    30,
    30,
    30,
    30,
    30,
    30,
    30,
    30,
    30,
    30,
    30,
    30,
    30,
    30
   ],
   "unit": "home_score_cumulative",
   "freq": "1play"
  }
 ],
 "task_type": "world_knowledge",
 "text_quality": "real",
 "series_id": "espn_college-football_401114167",
 "dataset": "espn_college",
 "source": "https://www.espn.com/football/boxscore/_/gameId/401114167",
 "license": "proprietary-review",
 "text_source": "third_party",
 "alignment": "describes",
 "domain": "sports",
 "region": "US",
 "period_start": "2019-10-05",
 "period_end": "2019-10-05",
 "meta": {
  "league": "CFB",
  "sport": "football",
  "espn_league_slug": "college-football",
  "event_id": "401114167",
  "espn_season_year": 2019,
  "away_team": "Arizona Wildcats",
  "home_team": "Colorado Buffaloes",
  "game_date": "2019-10-05T20:30Z",
  "n_plays": 190,
  "n_periods": 4,
  "period_end_idx": [
   42,
   96,
   146,
   189
  ],
  "score_fix_plays": 0,
  "final_away_score": 35,
  "final_home_score": 30,
  "report_headline": "Tate leads Arizona past Colorado 35-30",
  "report_source": "Associated Press",
  "report_published": "2019-10-06T01:32:34Z",
  "report_chars": 4743,
  "license_note": "Wire-service recap prose served via ESPN's API; article.source is recorded per record. Same rightsholder chain as 51_espn_us_majors (AP). Tagged proprietary-review -- not cleared for distribution.",
  "source_allowlist": [
   "AP",
   "Associated Press"
  ]
 }
}